taskinstr_resp.keys,taskinstr_resp.rt,task_instr_loop.thisRepN,task_instr_loop.thisTrialN,task_instr_loop.thisN,task_instr_loop.thisIndex,task_instr_loop.ran,instruct_num,instruct_text,participant,date,expName,psychopyVersion,OS,frameRate,sentence_resp.keys,sentence_resp.rt,probe_resp.keys,passage1_loop.thisRepN,passage1_loop.thisTrialN,passage1_loop.thisN,passage1_loop.thisIndex,passage1_loop.ran,passage,line,line_text,probe,condition,condition_num,set,probe_resp.rt,compr_instr_resp.keys,compr_instr_resp.rt,comprehension_resp.keys,comprehension_resp.corr,comprehension_resp.rt,comprehension1_loop.thisRepN,comprehension1_loop.thisTrialN,comprehension1_loop.thisN,comprehension1_loop.thisIndex,comprehension1_loop.ran,correct_response,passage2_loop.thisRepN,passage2_loop.thisTrialN,passage2_loop.thisN,passage2_loop.thisIndex,passage2_loop.ran,comprehension2_loop.thisRepN,comprehension2_loop.thisTrialN,comprehension2_loop.thisN,comprehension2_loop.thisIndex,comprehension2_loop.ran,passage3_loop.thisRepN,passage3_loop.thisTrialN,passage3_loop.thisN,passage3_loop.thisIndex,passage3_loop.ran,comprehension3_loop.thisRepN,comprehension3_loop.thisTrialN,comprehension3_loop.thisN,comprehension3_loop.thisIndex,comprehension3_loop.ran,passage4_loop.thisRepN,passage4_loop.thisTrialN,passage4_loop.thisN,passage4_loop.thisIndex,passage4_loop.ran,comprehension4_loop.thisRepN,comprehension4_loop.thisTrialN,comprehension4_loop.thisN,comprehension4_loop.thisIndex,comprehension4_loop.ran,passage5_loop.thisRepN,passage5_loop.thisTrialN,passage5_loop.thisN,passage5_loop.thisIndex,passage5_loop.ran,comprehension5_loop.thisRepN,comprehension5_loop.thisTrialN,comprehension5_loop.thisN,comprehension5_loop.thisIndex,comprehension5_loop.ran,passage6_loop.thisRepN,passage6_loop.thisTrialN,passage6_loop.thisN,passage6_loop.thisIndex,passage6_loop.ran,comprehension6_loop.thisRepN,comprehension6_loop.thisTrialN,comprehension6_loop.thisN,comprehension6_loop.thisIndex,comprehension6_loop.ran,passage7_loop.thisRepN,passage7_loop.thisTrialN,passage7_loop.thisN,passage7_loop.thisIndex,passage7_loop.ran,comprehension7_loop.thisRepN,comprehension7_loop.thisTrialN,comprehension7_loop.thisN,comprehension7_loop.thisIndex,comprehension7_loop.ran,passage8_loop.thisRepN,passage8_loop.thisTrialN,passage8_loop.thisN,passage8_loop.thisIndex,passage8_loop.ran,comprehension8_loop.thisRepN,comprehension8_loop.thisTrialN,comprehension8_loop.thisN,comprehension8_loop.thisIndex,comprehension8_loop.ran,Thankyou_resp.keys,Thankyou_resp.rt
space,115.843645,0,0,0,0,1,1,"TASK INSTRUCTIONS - PLEASE READ CAREFULLY!

The goal of this study is to learn how mind wandering affects how you learn information during reading. Mind wandering is a term used to describe what occurs when your attention wanders from a task. Sometimes when your mind wanders, you begin thinking about personal events or concerns rather than your task. At other times, your mind can wander because you are bored or tired and you don’t really know what you’re thinking about; all you know is that you are no longer thinking about your task.

Please press the space bar to continue.",M048646,2020-07-27_15h19.04.388,Feng_Mindwandering_Set1,2020.1.3,Win32,60,,,,,,,,,,,,,,,,,,,,,,,,,,,,,,,,,,,,,,,,,,,,,,,,,,,,,,,,,,,,,,,,,,,,,,,,,,,,,,,,,,,,,,,,,,,,,,,,,,,
space,28.71511,0,1,1,1,1,2,"In this experiment, you will read 8 passages and answer reading comprehension questions for each passage. THE PASSAGES WILL BE PRESENTED IN A SENTENCE-BY-SENTENCE FASHION. PLEASE READ THE SENTENCES AT YOUR NORMAL READING PACE. ONCE YOU HAVE FINISHED READING ONE SENTENCE, PRESS THE SPACE KEY TO MOVE ON TO THE NEXT SENTENCE. Once you've read the sentence you MAY NOT GO BACK.

Please press the space bar to continue.",M048646,2020-07-27_15h19.04.388,Feng_Mindwandering_Set1,2020.1.3,Win32,60,,,,,,,,,,,,,,,,,,,,,,,,,,,,,,,,,,,,,,,,,,,,,,,,,,,,,,,,,,,,,,,,,,,,,,,,,,,,,,,,,,,,,,,,,,,,,,,,,,,
space,11.83768,0,2,2,2,1,3,"THE SET OF READING COMPREHENSION QUESTIONS FOR THAT PARTICULAR PASSAGE YOU’VE FINISHED READING WILL APPEAR AFTER EACH PASSAGE, not all together at the end. Like the sentences, once you've answered the questions you MAY NOT GO BACK TO CHANGE YOUR ANSWER.

Please press the space bar to continue.",M048646,2020-07-27_15h19.04.388,Feng_Mindwandering_Set1,2020.1.3,Win32,60,,,,,,,,,,,,,,,,,,,,,,,,,,,,,,,,,,,,,,,,,,,,,,,,,,,,,,,,,,,,,,,,,,,,,,,,,,,,,,,,,,,,,,,,,,,,,,,,,,,
space,20.733965,0,3,3,3,1,5,"Additionally, while you are reading you will be randomly interrupted and asked “WERE YOU MIND WANDERING WHEN YOU READ THE PREVIOUS SENTENCE?"" as the question will appear on screen. That is, whether your thoughts were off-task rather than focusing on the prior sentence, in which you would have to choose either “Yes” or “No” by pressing the ""Y"" for Yes or ""N"" for No on your keyboard.

Please press the space bar to continue.",M048646,2020-07-27_15h19.04.388,Feng_Mindwandering_Set1,2020.1.3,Win32,60,,,,,,,,,,,,,,,,,,,,,,,,,,,,,,,,,,,,,,,,,,,,,,,,,,,,,,,,,,,,,,,,,,,,,,,,,,,,,,,,,,,,,,,,,,,,,,,,,,,
space,15.692185,0,4,4,4,1,6,"This entire experiment is self-paced. Though of course you should try NOT TO go over the experiment's ending time of 30 minutes. So try to do the task all the way through instead of taking too many small breaks in between. The experiment isn't long so you should be able to do it without taking any breaks. 

Please press the space bar to continue.",M048646,2020-07-27_15h19.04.388,Feng_Mindwandering_Set1,2020.1.3,Win32,60,,,,,,,,,,,,,,,,,,,,,,,,,,,,,,,,,,,,,,,,,,,,,,,,,,,,,,,,,,,,,,,,,,,,,,,,,,,,,,,,,,,,,,,,,,,,,,,,,,,
space,1.13337,0,5,5,5,1,7,Please press the space bar to start reading the first passage.,M048646,2020-07-27_15h19.04.388,Feng_Mindwandering_Set1,2020.1.3,Win32,60,,,,,,,,,,,,,,,,,,,,,,,,,,,,,,,,,,,,,,,,,,,,,,,,,,,,,,,,,,,,,,,,,,,,,,,,,,,,,,,,,,,,,,,,,,,,,,,,,,,
,,,,,,,,,M048646,2020-07-27_15h19.04.388,Feng_Mindwandering_Set1,2020.1.3,Win32,60,space,3.62311,,0,0,0,0,1,1,0,Passage 1,0,Diff,1,1,,,,,,,,,,,,,,,,,,,,,,,,,,,,,,,,,,,,,,,,,,,,,,,,,,,,,,,,,,,,,,,,,,,,,,,,,,,,,,,,,,,,
,,,,,,,,,M048646,2020-07-27_15h19.04.388,Feng_Mindwandering_Set1,2020.1.3,Win32,60,space,8.95695,,0,1,1,1,1,1,1,"A few had been astute enough to see a fine poet in Browning, and Elizabeth Barrett was one of them. ",0,Diff,1,1,,,,,,,,,,,,,,,,,,,,,,,,,,,,,,,,,,,,,,,,,,,,,,,,,,,,,,,,,,,,,,,,,,,,,,,,,,,,,,,,,,,,
,,,,,,,,,M048646,2020-07-27_15h19.04.388,Feng_Mindwandering_Set1,2020.1.3,Win32,60,space,11.862335,n,0,2,2,2,1,1,2,"The young man with the lemon-colored gloves and long dark hair and high-strung, restless manner who had visited her in 1846 had been moved to write to her because she had praised his poetry.",1,Diff,1,1,2.578205,,,,,,,,,,,,,,,,,,,,,,,,,,,,,,,,,,,,,,,,,,,,,,,,,,,,,,,,,,,,,,,,,,,,,,,,,,,,,,,,,,,
,,,,,,,,,M048646,2020-07-27_15h19.04.388,Feng_Mindwandering_Set1,2020.1.3,Win32,60,space,23.053935,n,0,3,3,3,1,1,3,"She found the man even more to her liking than the verse, and it was not so very long-only the time between May, 1845 and September, 1846-before Robert Browning had stolen the poetess from the dour father who guarded her like a dragon (never wanting her to marry any man), and taken her with him to Italy and a new life.",1,Diff,1,1,1.395805,,,,,,,,,,,,,,,,,,,,,,,,,,,,,,,,,,,,,,,,,,,,,,,,,,,,,,,,,,,,,,,,,,,,,,,,,,,,,,,,,,,
,,,,,,,,,M048646,2020-07-27_15h19.04.388,Feng_Mindwandering_Set1,2020.1.3,Win32,60,space,12.67348,,0,4,4,4,1,1,4,"One morning, soon after their nuptials, Elizabeth Browning thrust a manuscript into her husband’s pocket, and then scampered upstairs in a swift confusion to her room. ",0,Diff,1,1,,,,,,,,,,,,,,,,,,,,,,,,,,,,,,,,,,,,,,,,,,,,,,,,,,,,,,,,,,,,,,,,,,,,,,,,,,,,,,,,,,,,
,,,,,,,,,M048646,2020-07-27_15h19.04.388,Feng_Mindwandering_Set1,2020.1.3,Win32,60,space,7.15843,,0,5,5,5,1,1,5,"Written during the time of their courtship and love missives, it was a sonnet sequence on their love.",0,Diff,1,1,,,,,,,,,,,,,,,,,,,,,,,,,,,,,,,,,,,,,,,,,,,,,,,,,,,,,,,,,,,,,,,,,,,,,,,,,,,,,,,,,,,,
,,,,,,,,,M048646,2020-07-27_15h19.04.388,Feng_Mindwandering_Set1,2020.1.3,Win32,60,space,7.263985,,0,6,6,6,1,1,6,"These poems were never intended by Mrs. Browning to be published, but her poet husband promptly declared that they must be. ",0,Diff,1,1,,,,,,,,,,,,,,,,,,,,,,,,,,,,,,,,,,,,,,,,,,,,,,,,,,,,,,,,,,,,,,,,,,,,,,,,,,,,,,,,,,,,
,,,,,,,,,M048646,2020-07-27_15h19.04.388,Feng_Mindwandering_Set1,2020.1.3,Win32,60,space,6.260465,,0,7,7,7,1,1,7,The Sonnets from the Portuguese was his suggested title—a title which might shroud the fact that they were personal. ,0,Diff,1,1,,,,,,,,,,,,,,,,,,,,,,,,,,,,,,,,,,,,,,,,,,,,,,,,,,,,,,,,,,,,,,,,,,,,,,,,,,,,,,,,,,,,
,,,,,,,,,M048646,2020-07-27_15h19.04.388,Feng_Mindwandering_Set1,2020.1.3,Win32,60,space,4.5716,,0,8,8,8,1,1,8,They were in his mind “the finest sonnets written in our language since Shakespeare’s.”,0,Diff,1,1,,,,,,,,,,,,,,,,,,,,,,,,,,,,,,,,,,,,,,,,,,,,,,,,,,,,,,,,,,,,,,,,,,,,,,,,,,,,,,,,,,,,
,,,,,,,,,M048646,2020-07-27_15h19.04.388,Feng_Mindwandering_Set1,2020.1.3,Win32,60,space,7.77473,,0,9,9,9,1,1,9,"Sonnets from the Portuguese, in Browning’s opinion, was hardly more flattering to his wife than his opinion of most of her poetry. ",0,Diff,1,1,,,,,,,,,,,,,,,,,,,,,,,,,,,,,,,,,,,,,,,,,,,,,,,,,,,,,,,,,,,,,,,,,,,,,,,,,,,,,,,,,,,,
,,,,,,,,,M048646,2020-07-27_15h19.04.388,Feng_Mindwandering_Set1,2020.1.3,Win32,60,space,6.05392,,0,10,10,10,1,1,10,"A better poet than he, thought Browning, and the world at that time agreed with him.",0,Diff,1,1,,,,,,,,,,,,,,,,,,,,,,,,,,,,,,,,,,,,,,,,,,,,,,,,,,,,,,,,,,,,,,,,,,,,,,,,,,,,,,,,,,,,
,,,,,,,,,M048646,2020-07-27_15h19.04.388,Feng_Mindwandering_Set1,2020.1.3,Win32,60,space,4.71216,,0,11,11,11,1,1,11,"He called her his “moon of poets,” as she considered him her sun.",0,Diff,1,1,,,,,,,,,,,,,,,,,,,,,,,,,,,,,,,,,,,,,,,,,,,,,,,,,,,,,,,,,,,,,,,,,,,,,,,,,,,,,,,,,,,,
,,,,,,,,,M048646,2020-07-27_15h19.04.388,Feng_Mindwandering_Set1,2020.1.3,Win32,60,space,5.81195,,0,12,12,12,1,1,12,"She was a pure singer with a lovely lyrical tenderness, the best poet of her sex since Sappho. ",0,Diff,1,1,,,,,,,,,,,,,,,,,,,,,,,,,,,,,,,,,,,,,,,,,,,,,,,,,,,,,,,,,,,,,,,,,,,,,,,,,,,,,,,,,,,,
,,,,,,,,,M048646,2020-07-27_15h19.04.388,Feng_Mindwandering_Set1,2020.1.3,Win32,60,space,14.44361,,0,13,13,13,1,1,13,"Her Sonnets, in their autobiographical candor, in their fine restraint and fullness, reveal a woman’s secret soul as had no other poetry in our literature up to that time. ",0,Diff,1,1,,,,,,,,,,,,,,,,,,,,,,,,,,,,,,,,,,,,,,,,,,,,,,,,,,,,,,,,,,,,,,,,,,,,,,,,,,,,,,,,,,,,
,,,,,,,,,M048646,2020-07-27_15h19.04.388,Feng_Mindwandering_Set1,2020.1.3,Win32,60,space,3.95156,,0,14,14,14,1,1,14,Her lyrical mastery shines in many passages of her writings.,0,Diff,1,1,,,,,,,,,,,,,,,,,,,,,,,,,,,,,,,,,,,,,,,,,,,,,,,,,,,,,,,,,,,,,,,,,,,,,,,,,,,,,,,,,,,,
,,,,,,,,,M048646,2020-07-27_15h19.04.388,Feng_Mindwandering_Set1,2020.1.3,Win32,60,space,2.794785,,0,15,15,15,1,1,15,Italy was a kind of promised terrain for Elizabeth Browning. ,0,Diff,1,1,,,,,,,,,,,,,,,,,,,,,,,,,,,,,,,,,,,,,,,,,,,,,,,,,,,,,,,,,,,,,,,,,,,,,,,,,,,,,,,,,,,,
,,,,,,,,,M048646,2020-07-27_15h19.04.388,Feng_Mindwandering_Set1,2020.1.3,Win32,60,space,12.696315,,0,16,16,16,1,1,16,"Living in Florence or in little villages in the summers, she drank in the sun of the south and warmth of her husband’s love, and blossomed in a life of precarious happiness for fifteen years. ",0,Diff,1,1,,,,,,,,,,,,,,,,,,,,,,,,,,,,,,,,,,,,,,,,,,,,,,,,,,,,,,,,,,,,,,,,,,,,,,,,,,,,,,,,,,,,
,,,,,,,,,M048646,2020-07-27_15h19.04.388,Feng_Mindwandering_Set1,2020.1.3,Win32,60,space,9.14214,,0,17,17,17,1,1,17,"In Italy she found friends, most of them cultured Americans.",0,Diff,1,1,,,,,,,,,,,,,,,,,,,,,,,,,,,,,,,,,,,,,,,,,,,,,,,,,,,,,,,,,,,,,,,,,,,,,,,,,,,,,,,,,,,,
,,,,,,,,,M048646,2020-07-27_15h19.04.388,Feng_Mindwandering_Set1,2020.1.3,Win32,60,space,8.05433,n,0,18,18,18,1,1,18,Hawthorne saw the Browning's there: the New England thinker and essayist Margaret Fuller visited them.,1,Diff,1,1,4.47061,,,,,,,,,,,,,,,,,,,,,,,,,,,,,,,,,,,,,,,,,,,,,,,,,,,,,,,,,,,,,,,,,,,,,,,,,,,,,,,,,,,
,,,,,,,,,M048646,2020-07-27_15h19.04.388,Feng_Mindwandering_Set1,2020.1.3,Win32,60,space,4.189505,,0,19,19,19,1,1,19,"The painter Story came, and the young sculptress Harriet Hosmer. ",0,Diff,1,1,,,,,,,,,,,,,,,,,,,,,,,,,,,,,,,,,,,,,,,,,,,,,,,,,,,,,,,,,,,,,,,,,,,,,,,,,,,,,,,,,,,,
,,,,,,,,,M048646,2020-07-27_15h19.04.388,Feng_Mindwandering_Set1,2020.1.3,Win32,60,space,8.541105,n,0,20,20,20,1,1,20,"One caller records that Robert Browning was “simple, natural, and playful,” and that Mrs. Browning was all ""genius and sensibility.”",1,Diff,1,1,1.32746,,,,,,,,,,,,,,,,,,,,,,,,,,,,,,,,,,,,,,,,,,,,,,,,,,,,,,,,,,,,,,,,,,,,,,,,,,,,,,,,,,,
,,,,,,,,,M048646,2020-07-27_15h19.04.388,Feng_Mindwandering_Set1,2020.1.3,Win32,60,space,7.46602,n,0,21,21,21,1,1,21,"Daytimes Browning walked forth with Elizabeth's little dog Flush, but he seldom could be lured from his home evenings. ",1,Diff,1,1,1.29041,,,,,,,,,,,,,,,,,,,,,,,,,,,,,,,,,,,,,,,,,,,,,,,,,,,,,,,,,,,,,,,,,,,,,,,,,,,,,,,,,,,
,,,,,,,,,M048646,2020-07-27_15h19.04.388,Feng_Mindwandering_Set1,2020.1.3,Win32,60,space,7.79151,n,0,22,22,22,1,1,22,"One privileged intruder, coming frequently at night to join the poets over hot chestnuts and mulled wine, found talk good and laughter plentiful.",1,Diff,1,1,1.935115,,,,,,,,,,,,,,,,,,,,,,,,,,,,,,,,,,,,,,,,,,,,,,,,,,,,,,,,,,,,,,,,,,,,,,,,,,,,,,,,,,,
,,,,,,,,,M048646,2020-07-27_15h19.04.388,Feng_Mindwandering_Set1,2020.1.3,Win32,60,space,5.043995,,0,23,23,23,1,1,23,"During the third year of their stay in Italy, a son, Robert Weidemann Browning, was born.",0,Diff,1,1,,,,,,,,,,,,,,,,,,,,,,,,,,,,,,,,,,,,,,,,,,,,,,,,,,,,,,,,,,,,,,,,,,,,,,,,,,,,,,,,,,,,
,,,,,,,,,M048646,2020-07-27_15h19.04.388,Feng_Mindwandering_Set1,2020.1.3,Win32,60,space,5.628945,,0,24,24,24,1,1,24,But through this happy life a strain of dark foreboding began to creep. ,0,Diff,1,1,,,,,,,,,,,,,,,,,,,,,,,,,,,,,,,,,,,,,,,,,,,,,,,,,,,,,,,,,,,,,,,,,,,,,,,,,,,,,,,,,,,,
,,,,,,,,,M048646,2020-07-27_15h19.04.388,Feng_Mindwandering_Set1,2020.1.3,Win32,60,space,9.49922,,0,25,25,25,1,1,25,"Elizabeth Browning’s father died unrelenting in his disavowal of her marriage, refusing to see her or to sanction any of his family to see her. ",0,Diff,1,1,,,,,,,,,,,,,,,,,,,,,,,,,,,,,,,,,,,,,,,,,,,,,,,,,,,,,,,,,,,,,,,,,,,,,,,,,,,,,,,,,,,,
,,,,,,,,,M048646,2020-07-27_15h19.04.388,Feng_Mindwandering_Set1,2020.1.3,Win32,60,space,5.90446,,0,26,26,26,1,1,26,Three children all younger than her own boy were left to her by a dearly beloved sister who died. ,0,Diff,1,1,,,,,,,,,,,,,,,,,,,,,,,,,,,,,,,,,,,,,,,,,,,,,,,,,,,,,,,,,,,,,,,,,,,,,,,,,,,,,,,,,,,,
,,,,,,,,,M048646,2020-07-27_15h19.04.388,Feng_Mindwandering_Set1,2020.1.3,Win32,60,space,4.75954,,0,27,27,27,1,1,27,She drooped and pined a little and Browning shielded her from ordinary visitants. ,0,Diff,1,1,,,,,,,,,,,,,,,,,,,,,,,,,,,,,,,,,,,,,,,,,,,,,,,,,,,,,,,,,,,,,,,,,,,,,,,,,,,,,,,,,,,,
,,,,,,,,,M048646,2020-07-27_15h19.04.388,Feng_Mindwandering_Set1,2020.1.3,Win32,60,space,7.545385,,0,28,28,28,1,1,28,She had a sudden and alarming attack of indisposition but was not considered in any precariousness. ,0,Diff,1,1,,,,,,,,,,,,,,,,,,,,,,,,,,,,,,,,,,,,,,,,,,,,,,,,,,,,,,,,,,,,,,,,,,,,,,,,,,,,,,,,,,,,
,,,,,,,,,M048646,2020-07-27_15h19.04.388,Feng_Mindwandering_Set1,2020.1.3,Win32,60,space,16.69146,,0,29,29,29,1,1,29,"One night, soon after, she awoke from a troubled slumber and, apparently with no idea that she was about to leave him, murmured in the tenderest fashion of her love for him, and in his arms her head drooped as though in a faint, but it was the end.",0,Diff,1,1,,,,,,,,,,,,,,,,,,,,,,,,,,,,,,,,,,,,,,,,,,,,,,,,,,,,,,,,,,,,,,,,,,,,,,,,,,,,,,,,,,,,
,,,,,,,,,M048646,2020-07-27_15h19.04.388,Feng_Mindwandering_Set1,2020.1.3,Win32,60,space,8.1184,n,0,30,30,30,1,1,30,"Profound and lasting was Browning's grief. “Looking back,” he said, “I see that we have been all the time walking over a torrent on a straw.”",1,Diff,1,1,2.29505,,,,,,,,,,,,,,,,,,,,,,,,,,,,,,,,,,,,,,,,,,,,,,,,,,,,,,,,,,,,,,,,,,,,,,,,,,,,,,,,,,,
,,,,,,,,,M048646,2020-07-27_15h19.04.388,Feng_Mindwandering_Set1,2020.1.3,Win32,60,,,,,,,,,1,1,"1.     Flush was the name of the Brownings’

a.     Cat
b.     Dog
c.     Canary
d.     Turtle
e.     Thrush",,,,,,space,14.4802,b,1,7.21281,0,0,0,0,1,b,,,,,,,,,,,,,,,,,,,,,,,,,,,,,,,,,,,,,,,,,,,,,,,,,,,,,,,,,,,,,,,,,,,,,,,,
,,,,,,,,,M048646,2020-07-27_15h19.04.388,Feng_Mindwandering_Set1,2020.1.3,Win32,60,,,,,,,,,1,2,"2.     At night the Brownings often enjoyed

a.     hot chestnuts
b.     a tart with clotted cream
c.      strawberries and cream
d.     café au lait
e.     cheese soufflé",,,,,,,,a,1,4.53619,0,1,1,1,1,a,,,,,,,,,,,,,,,,,,,,,,,,,,,,,,,,,,,,,,,,,,,,,,,,,,,,,,,,,,,,,,,,,,,,,,,,
,,,,,,,,,M048646,2020-07-27_15h19.04.388,Feng_Mindwandering_Set1,2020.1.3,Win32,60,,,,,,,,,1,3,"3.     The Brownings saw

a.     Coleridge
b.     Byron
c.     Walt Whitman
d.     Poe
e.     Hawthorne",,,,,,,,e,1,4.565605,0,2,2,2,1,e,,,,,,,,,,,,,,,,,,,,,,,,,,,,,,,,,,,,,,,,,,,,,,,,,,,,,,,,,,,,,,,,,,,,,,,,
,,,,,,,,,M048646,2020-07-27_15h19.04.388,Feng_Mindwandering_Set1,2020.1.3,Win32,60,,,,,,,,,1,4,"4.     Browning wrote to Miss Barrett because she had

a.     invited him to visit
b.     written him for advice
c.     praised his poetry
d.     sent him one of her own poems
e.     sent a friend to meet him",,,,,,,,d,0,15.54893,0,3,3,3,1,c,,,,,,,,,,,,,,,,,,,,,,,,,,,,,,,,,,,,,,,,,,,,,,,,,,,,,,,,,,,,,,,,,,,,,,,,
,,,,,,,,,M048646,2020-07-27_15h19.04.388,Feng_Mindwandering_Set1,2020.1.3,Win32,60,,,,,,,,,1,5,"5.     The authors of this passage placed most attention on the Brownings’

a.     literary efforts
b.     personal relationship
c.     social contacts
d.     problems
e.     early meeting",,,,,,,,b,1,10.27001,0,4,4,4,1,b,,,,,,,,,,,,,,,,,,,,,,,,,,,,,,,,,,,,,,,,,,,,,,,,,,,,,,,,,,,,,,,,,,,,,,,,
,,,,,,,,,M048646,2020-07-27_15h19.04.388,Feng_Mindwandering_Set1,2020.1.3,Win32,60,,,,,,,,,1,6,"6.     What best describes the Brownings’ early days abroad?

a.     Travel
b.     Relaxation
c.     Creative activity
d.     Intellectual stimulation
e.     Happiness",,,,,,,,a,0,6.39907,0,5,5,5,1,e,,,,,,,,,,,,,,,,,,,,,,,,,,,,,,,,,,,,,,,,,,,,,,,,,,,,,,,,,,,,,,,,,,,,,,,,
,,,,,,,,,M048646,2020-07-27_15h19.04.388,Feng_Mindwandering_Set1,2020.1.3,Win32,60,,,,,,,,,1,7,"7.     You would assume that Browning

a.     found it easy to see Elizabeth
b.     carefully avoided Mr. Barrett
c.     begged Mr. Barrett’s consent to marry
d.     understood Mr. Barrett
e.     got Elizabeth to ask her father’s consent",,,,,,,,c,0,31.55725,0,6,6,6,1,b,,,,,,,,,,,,,,,,,,,,,,,,,,,,,,,,,,,,,,,,,,,,,,,,,,,,,,,,,,,,,,,,,,,,,,,,
,,,,,,,,,M048646,2020-07-27_15h19.04.388,Feng_Mindwandering_Set1,2020.1.3,Win32,60,,,,,,,,,1,8,"8.     In the “torrent on a straw” quotation, the word straw probably refers to

a.     the frailty of life
b.     weakness of character
c.     sorrow
d.     happiness
e.     the fleeting nature of fame",,,,,,,,a,1,10.344,0,7,7,7,1,a,,,,,,,,,,,,,,,,,,,,,,,,,,,,,,,,,,,,,,,,,,,,,,,,,,,,,,,,,,,,,,,,,,,,,,,,
,,,,,,,,,M048646,2020-07-27_15h19.04.388,Feng_Mindwandering_Set1,2020.1.3,Win32,60,space,3.11155,,,,,,,2,0,Passage 2,0,Easy,2,1,,,,,,,,,,,,,0,0,0,0,1,,,,,,,,,,,,,,,,,,,,,,,,,,,,,,,,,,,,,,,,,,,,,,,,,,,,,,,,,,,,,,,,,,,
,,,,,,,,,M048646,2020-07-27_15h19.04.388,Feng_Mindwandering_Set1,2020.1.3,Win32,60,space,6.465825,,,,,,,2,1,Marketing is a business activity that directs the flow of goods and services from a producer to a consumer or user.,0,Easy,2,1,,,,,,,,,,,,,0,1,1,1,1,,,,,,,,,,,,,,,,,,,,,,,,,,,,,,,,,,,,,,,,,,,,,,,,,,,,,,,,,,,,,,,,,,,
,,,,,,,,,M048646,2020-07-27_15h19.04.388,Feng_Mindwandering_Set1,2020.1.3,Win32,60,space,6.318765,,,,,,,2,2,It is the link that connects producers and consumers and brings production and consumption together.,0,Easy,2,1,,,,,,,,,,,,,0,2,2,2,1,,,,,,,,,,,,,,,,,,,,,,,,,,,,,,,,,,,,,,,,,,,,,,,,,,,,,,,,,,,,,,,,,,,
,,,,,,,,,M048646,2020-07-27_15h19.04.388,Feng_Mindwandering_Set1,2020.1.3,Win32,60,space,4.313505,,,,,,,2,3,About one in every six employees is involved directly in wholesaling or retailing activities.,0,Easy,2,1,,,,,,,,,,,,,0,3,3,3,1,,,,,,,,,,,,,,,,,,,,,,,,,,,,,,,,,,,,,,,,,,,,,,,,,,,,,,,,,,,,,,,,,,,
,,,,,,,,,M048646,2020-07-27_15h19.04.388,Feng_Mindwandering_Set1,2020.1.3,Win32,60,space,5.83497,,,,,,,2,4,"This ratio does not take into account other employees who assist marketing through transportation, communication, and office jobs.",0,Easy,2,1,,,,,,,,,,,,,0,4,4,4,1,,,,,,,,,,,,,,,,,,,,,,,,,,,,,,,,,,,,,,,,,,,,,,,,,,,,,,,,,,,,,,,,,,,
,,,,,,,,,M048646,2020-07-27_15h19.04.388,Feng_Mindwandering_Set1,2020.1.3,Win32,60,space,2.80755,,,,,,,2,5,Marketing provides many different kinds of jobs.,0,Easy,2,1,,,,,,,,,,,,,0,5,5,5,1,,,,,,,,,,,,,,,,,,,,,,,,,,,,,,,,,,,,,,,,,,,,,,,,,,,,,,,,,,,,,,,,,,,
,,,,,,,,,M048646,2020-07-27_15h19.04.388,Feng_Mindwandering_Set1,2020.1.3,Win32,60,space,3.112405,,,,,,,2,6,These jobs require a wide range of skills and abilities.,0,Easy,2,1,,,,,,,,,,,,,0,6,6,6,1,,,,,,,,,,,,,,,,,,,,,,,,,,,,,,,,,,,,,,,,,,,,,,,,,,,,,,,,,,,,,,,,,,,
,,,,,,,,,M048646,2020-07-27_15h19.04.388,Feng_Mindwandering_Set1,2020.1.3,Win32,60,space,7.866915,,,,,,,2,7,"We usually think that the primary job in marketing is selling, but there are jobs in management, advertising, market and product research, and buying.",0,Easy,2,1,,,,,,,,,,,,,0,7,7,7,1,,,,,,,,,,,,,,,,,,,,,,,,,,,,,,,,,,,,,,,,,,,,,,,,,,,,,,,,,,,,,,,,,,,
,,,,,,,,,M048646,2020-07-27_15h19.04.388,Feng_Mindwandering_Set1,2020.1.3,Win32,60,space,4.55701,n,,,,,,2,8,"The economic well-being of our country is determined largely by productivity, consumption, and employment.",1,Easy,2,1,2.32809,,,,,,,,,,,,0,8,8,8,1,,,,,,,,,,,,,,,,,,,,,,,,,,,,,,,,,,,,,,,,,,,,,,,,,,,,,,,,,,,,,,,,,,,
,,,,,,,,,M048646,2020-07-27_15h19.04.388,Feng_Mindwandering_Set1,2020.1.3,Win32,60,space,2.056165,,,,,,,2,9,The efficiency of marketing affects all three.,0,Easy,2,1,,,,,,,,,,,,,0,9,9,9,1,,,,,,,,,,,,,,,,,,,,,,,,,,,,,,,,,,,,,,,,,,,,,,,,,,,,,,,,,,,,,,,,,,,
,,,,,,,,,M048646,2020-07-27_15h19.04.388,Feng_Mindwandering_Set1,2020.1.3,Win32,60,space,3.708555,,,,,,,2,10,People consume many goods if marketing creates a demand.,0,Easy,2,1,,,,,,,,,,,,,0,10,10,10,1,,,,,,,,,,,,,,,,,,,,,,,,,,,,,,,,,,,,,,,,,,,,,,,,,,,,,,,,,,,,,,,,,,,
,,,,,,,,,M048646,2020-07-27_15h19.04.388,Feng_Mindwandering_Set1,2020.1.3,Win32,60,space,9.49161,n,,,,,,2,11,"High consumption requires high productivity to meet the wants of people, and high productivity and high-level activity in marketing combined result in high employment.",1,Easy,2,1,1.57367,,,,,,,,,,,,0,11,11,11,1,,,,,,,,,,,,,,,,,,,,,,,,,,,,,,,,,,,,,,,,,,,,,,,,,,,,,,,,,,,,,,,,,,,
,,,,,,,,,M048646,2020-07-27_15h19.04.388,Feng_Mindwandering_Set1,2020.1.3,Win32,60,space,4.26059,,,,,,,2,12,Marketing is indirectly a key to a high economic level of living for the people.,0,Easy,2,1,,,,,,,,,,,,,0,12,12,12,1,,,,,,,,,,,,,,,,,,,,,,,,,,,,,,,,,,,,,,,,,,,,,,,,,,,,,,,,,,,,,,,,,,,
,,,,,,,,,M048646,2020-07-27_15h19.04.388,Feng_Mindwandering_Set1,2020.1.3,Win32,60,,,,,,,,,2,1,"1.     Our economic well-being is determined largely by how many factors?

a.     One
b.     Two
c.     Three
d.     Four
e.     Five",,,,,,space,7.156655,c,1,12.863535,,,,,,c,,,,,,0,0,0,0,1,,,,,,,,,,,,,,,,,,,,,,,,,,,,,,,,,,,,,,,,,,,,,,,,,,,,,,,,,,,,,,
,,,,,,,,,M048646,2020-07-27_15h19.04.388,Feng_Mindwandering_Set1,2020.1.3,Win32,60,,,,,,,,,2,2,"2.     One major factor mentioned as affecting our economic well-being was

a.     high wages
b.     low interest rates
c.     technology
d.     employment
e.     foreign trade",,,,,,,,e,0,13.846995,,,,,,d,,,,,,0,1,1,1,1,,,,,,,,,,,,,,,,,,,,,,,,,,,,,,,,,,,,,,,,,,,,,,,,,,,,,,,,,,,,,,
,,,,,,,,,M048646,2020-07-27_15h19.04.388,Feng_Mindwandering_Set1,2020.1.3,Win32,60,,,,,,,,,2,3,"3.     The purpose of this passage is to

a.     persuade
b.     guide
c.     evaluate
d.     inform
e.     Interest",,,,,,,,d,1,6.398605,,,,,,d,,,,,,0,2,2,2,1,,,,,,,,,,,,,,,,,,,,,,,,,,,,,,,,,,,,,,,,,,,,,,,,,,,,,,,,,,,,,,
,,,,,,,,,M048646,2020-07-27_15h19.04.388,Feng_Mindwandering_Set1,2020.1.3,Win32,60,,,,,,,,,2,4,"4.     The chief emphasis is on

a.     defining marketing
b.     principles of marketing
c.     opportunities in marketing
d.     kinds of jobs in marketing
e.     the economic significance of marketing",,,,,,,,e,1,13.850305,,,,,,e,,,,,,0,3,3,3,1,,,,,,,,,,,,,,,,,,,,,,,,,,,,,,,,,,,,,,,,,,,,,,,,,,,,,,,,,,,,,,
,,,,,,,,,M048646,2020-07-27_15h19.04.388,Feng_Mindwandering_Set1,2020.1.3,Win32,60,space,0.968795,,,,,,,3,0,Passage 3,0,Diff.,1,1,,,,,,,,,,,,,,,,,,,,,,,0,0,0,0,1,,,,,,,,,,,,,,,,,,,,,,,,,,,,,,,,,,,,,,,,,,,,,,,,,,,,,,,,,
,,,,,,,,,M048646,2020-07-27_15h19.04.388,Feng_Mindwandering_Set1,2020.1.3,Win32,60,space,3.865195,,,,,,,3,1,Atomic energy is the energy that holds the nucleus of an atom together.,0,Diff.,1,1,,,,,,,,,,,,,,,,,,,,,,,0,1,1,1,1,,,,,,,,,,,,,,,,,,,,,,,,,,,,,,,,,,,,,,,,,,,,,,,,,,,,,,,,,
,,,,,,,,,M048646,2020-07-27_15h19.04.388,Feng_Mindwandering_Set1,2020.1.3,Win32,60,space,8.241175,,,,,,,3,2,Atomic reactions in which nuclei of helium are built up from nuclei of hydrogen are believed to be the origin of the sun’s energy.,0,Diff.,1,1,,,,,,,,,,,,,,,,,,,,,,,0,2,2,2,1,,,,,,,,,,,,,,,,,,,,,,,,,,,,,,,,,,,,,,,,,,,,,,,,,,,,,,,,,
,,,,,,,,,M048646,2020-07-27_15h19.04.388,Feng_Mindwandering_Set1,2020.1.3,Win32,60,space,8.05752,,,,,,,3,3,It has been found that the mass of an atomic nucleus is less than the total mass of the separate particles that comprise it.,0,Diff.,1,1,,,,,,,,,,,,,,,,,,,,,,,0,3,3,3,1,,,,,,,,,,,,,,,,,,,,,,,,,,,,,,,,,,,,,,,,,,,,,,,,,,,,,,,,,
