taskinstr_resp.keys,taskinstr_resp.rt,task_instr_loop.thisRepN,task_instr_loop.thisTrialN,task_instr_loop.thisN,task_instr_loop.thisIndex,task_instr_loop.ran,instruct_num,instruct_text,participant,date,expName,psychopyVersion,OS,frameRate,sentence_resp.keys,sentence_resp.rt,probe_resp.keys,passage1_loop.thisRepN,passage1_loop.thisTrialN,passage1_loop.thisN,passage1_loop.thisIndex,passage1_loop.ran,passage,line,line_text,probe,condition,condition_num,set,probe_resp.rt,compr_instr_resp.keys,compr_instr_resp.rt,comprehension_resp.keys,comprehension_resp.corr,comprehension_resp.rt,comprehension1_loop.thisRepN,comprehension1_loop.thisTrialN,comprehension1_loop.thisN,comprehension1_loop.thisIndex,comprehension1_loop.ran,correct_response,passage2_loop.thisRepN,passage2_loop.thisTrialN,passage2_loop.thisN,passage2_loop.thisIndex,passage2_loop.ran,comprehension2_loop.thisRepN,comprehension2_loop.thisTrialN,comprehension2_loop.thisN,comprehension2_loop.thisIndex,comprehension2_loop.ran,passage3_loop.thisRepN,passage3_loop.thisTrialN,passage3_loop.thisN,passage3_loop.thisIndex,passage3_loop.ran,comprehension3_loop.thisRepN,comprehension3_loop.thisTrialN,comprehension3_loop.thisN,comprehension3_loop.thisIndex,comprehension3_loop.ran,passage4_loop.thisRepN,passage4_loop.thisTrialN,passage4_loop.thisN,passage4_loop.thisIndex,passage4_loop.ran,comprehension4_loop.thisRepN,comprehension4_loop.thisTrialN,comprehension4_loop.thisN,comprehension4_loop.thisIndex,comprehension4_loop.ran,passage5_loop.thisRepN,passage5_loop.thisTrialN,passage5_loop.thisN,passage5_loop.thisIndex,passage5_loop.ran,comprehension5_loop.thisRepN,comprehension5_loop.thisTrialN,comprehension5_loop.thisN,comprehension5_loop.thisIndex,comprehension5_loop.ran,passage6_loop.thisRepN,passage6_loop.thisTrialN,passage6_loop.thisN,passage6_loop.thisIndex,passage6_loop.ran,comprehension6_loop.thisRepN,comprehension6_loop.thisTrialN,comprehension6_loop.thisN,comprehension6_loop.thisIndex,comprehension6_loop.ran,passage7_loop.thisRepN,passage7_loop.thisTrialN,passage7_loop.thisN,passage7_loop.thisIndex,passage7_loop.ran,comprehension7_loop.thisRepN,comprehension7_loop.thisTrialN,comprehension7_loop.thisN,comprehension7_loop.thisIndex,comprehension7_loop.ran,passage8_loop.thisRepN,passage8_loop.thisTrialN,passage8_loop.thisN,passage8_loop.thisIndex,passage8_loop.ran,comprehension8_loop.thisRepN,comprehension8_loop.thisTrialN,comprehension8_loop.thisN,comprehension8_loop.thisIndex,comprehension8_loop.ran,Thankyou_resp.keys,Thankyou_resp.rt
space,35.174825,0,0,0,0,1,1,"TASK INSTRUCTIONS - PLEASE READ CAREFULLY!

The goal of this study is to learn how mind wandering affects how you learn information during reading. Mind wandering is a term used to describe what occurs when your attention wanders from a task. Sometimes when your mind wanders, you begin thinking about personal events or concerns rather than your task. At other times, your mind can wander because you are bored or tired and you don’t really know what you’re thinking about; all you know is that you are no longer thinking about your task.

Please press the space bar to continue.",M099499,2020-07-27_17h23.29.917,Feng_Mindwandering_Set2,2020.1.3,Win32,60,,,,,,,,,,,,,,,,,,,,,,,,,,,,,,,,,,,,,,,,,,,,,,,,,,,,,,,,,,,,,,,,,,,,,,,,,,,,,,,,,,,,,,,,,,,,,,,,,,,
space,49.53884,0,1,1,1,1,2,"In this experiment, you will read 8 passages and answer reading comprehension questions for each passage. THE PASSAGES WILL BE PRESENTED IN A SENTENCE-BY-SENTENCE FASHION. PLEASE READ THE SENTENCES AT YOUR NORMAL READING PACE. ONCE YOU HAVE FINISHED READING ONE SENTENCE, PRESS THE SPACE KEY TO MOVE ON TO THE NEXT SENTENCE. Once you've read the sentence you MAY NOT GO BACK.

Please press the space bar to continue.",M099499,2020-07-27_17h23.29.917,Feng_Mindwandering_Set2,2020.1.3,Win32,60,,,,,,,,,,,,,,,,,,,,,,,,,,,,,,,,,,,,,,,,,,,,,,,,,,,,,,,,,,,,,,,,,,,,,,,,,,,,,,,,,,,,,,,,,,,,,,,,,,,
space,10.11501,0,2,2,2,1,3,"THE SET OF READING COMPREHENSION QUESTIONS FOR THAT PARTICULAR PASSAGE YOU’VE FINISHED READING WILL APPEAR AFTER EACH PASSAGE, not all together at the end. Like the sentences, once you've answered the questions you MAY NOT GO BACK TO CHANGE YOUR ANSWER.

Please press the space bar to continue.",M099499,2020-07-27_17h23.29.917,Feng_Mindwandering_Set2,2020.1.3,Win32,60,,,,,,,,,,,,,,,,,,,,,,,,,,,,,,,,,,,,,,,,,,,,,,,,,,,,,,,,,,,,,,,,,,,,,,,,,,,,,,,,,,,,,,,,,,,,,,,,,,,
space,27.952865,0,3,3,3,1,5,"Additionally, while you are reading you will be randomly interrupted and asked “WERE YOU MIND WANDERING WHEN YOU READ THE PREVIOUS SENTENCE?"" as the question will appear on screen. That is, whether your thoughts were off-task rather than focusing on the prior sentence, in which you would have to choose either “Yes” or “No” by pressing the ""Y"" for Yes or ""N"" for No on your keyboard.

Please press the space bar to continue.",M099499,2020-07-27_17h23.29.917,Feng_Mindwandering_Set2,2020.1.3,Win32,60,,,,,,,,,,,,,,,,,,,,,,,,,,,,,,,,,,,,,,,,,,,,,,,,,,,,,,,,,,,,,,,,,,,,,,,,,,,,,,,,,,,,,,,,,,,,,,,,,,,
space,20.50895,0,4,4,4,1,6,"This entire experiment is self-paced. Though of course you should try NOT TO go over the experiment's ending time of 30 minutes. So try to do the task all the way through instead of taking too many small breaks in between. The experiment isn't long so you should be able to do it without taking any breaks. 

Please press the space bar to continue.",M099499,2020-07-27_17h23.29.917,Feng_Mindwandering_Set2,2020.1.3,Win32,60,,,,,,,,,,,,,,,,,,,,,,,,,,,,,,,,,,,,,,,,,,,,,,,,,,,,,,,,,,,,,,,,,,,,,,,,,,,,,,,,,,,,,,,,,,,,,,,,,,,
space,4.723795,0,5,5,5,1,7,Please press the space bar to start reading the first passage.,M099499,2020-07-27_17h23.29.917,Feng_Mindwandering_Set2,2020.1.3,Win32,60,,,,,,,,,,,,,,,,,,,,,,,,,,,,,,,,,,,,,,,,,,,,,,,,,,,,,,,,,,,,,,,,,,,,,,,,,,,,,,,,,,,,,,,,,,,,,,,,,,,
,,,,,,,,,M099499,2020-07-27_17h23.29.917,Feng_Mindwandering_Set2,2020.1.3,Win32,60,space,3.543505,,0,0,0,0,1,1,0,Passage 1,0,Easy,2,2,,,,,,,,,,,,,,,,,,,,,,,,,,,,,,,,,,,,,,,,,,,,,,,,,,,,,,,,,,,,,,,,,,,,,,,,,,,,,,,,,,,,
,,,,,,,,,M099499,2020-07-27_17h23.29.917,Feng_Mindwandering_Set2,2020.1.3,Win32,60,space,5.36086,,0,1,1,1,1,1,1,Elizabeth Barrett was wise enough to see that Browning was a fine poet.,0,Easy,2,2,,,,,,,,,,,,,,,,,,,,,,,,,,,,,,,,,,,,,,,,,,,,,,,,,,,,,,,,,,,,,,,,,,,,,,,,,,,,,,,,,,,,
,,,,,,,,,M099499,2020-07-27_17h23.29.917,Feng_Mindwandering_Set2,2020.1.3,Win32,60,space,31.984705,y,0,2,2,2,1,1,2,"The young man with the lemon-colored gloves and long dark hair and high-strung, restless manner who had visited her in 1846 had been moved to write to her because she had praised his poetry.",1,Easy,2,2,7.165965,,,,,,,,,,,,,,,,,,,,,,,,,,,,,,,,,,,,,,,,,,,,,,,,,,,,,,,,,,,,,,,,,,,,,,,,,,,,,,,,,,,
,,,,,,,,,M099499,2020-07-27_17h23.29.917,Feng_Mindwandering_Set2,2020.1.3,Win32,60,space,15.38559,n,0,3,3,3,1,1,3,"She found the man even more to her liking than the verse, and it was not so very long-only the time between May, 1845 and September, 1846-before Robert Browning had stolen the poetess from the dour father who guarded her like a dragon (never wanting her to marry any man), and taken her with him to Italy and a new life.",1,Easy,2,2,2.921785,,,,,,,,,,,,,,,,,,,,,,,,,,,,,,,,,,,,,,,,,,,,,,,,,,,,,,,,,,,,,,,,,,,,,,,,,,,,,,,,,,,
,,,,,,,,,M099499,2020-07-27_17h23.29.917,Feng_Mindwandering_Set2,2020.1.3,Win32,60,space,10.04456,,0,4,4,4,1,1,4,"One morning, soon after Robert and Elizabeth married; she thrust a manuscript into Robert’s pocket.",0,Easy,2,2,,,,,,,,,,,,,,,,,,,,,,,,,,,,,,,,,,,,,,,,,,,,,,,,,,,,,,,,,,,,,,,,,,,,,,,,,,,,,,,,,,,,
,,,,,,,,,M099499,2020-07-27_17h23.29.917,Feng_Mindwandering_Set2,2020.1.3,Win32,60,space,2.62974,,0,5,5,5,1,1,5,"Then she ran up to her room, embarrassed by her action.",0,Easy,2,2,,,,,,,,,,,,,,,,,,,,,,,,,,,,,,,,,,,,,,,,,,,,,,,,,,,,,,,,,,,,,,,,,,,,,,,,,,,,,,,,,,,,
,,,,,,,,,M099499,2020-07-27_17h23.29.917,Feng_Mindwandering_Set2,2020.1.3,Win32,60,space,4.09136,,0,6,6,6,1,1,6,The manuscript was a sonnet sequence that she had written about their courtship and their love letters.,0,Easy,2,2,,,,,,,,,,,,,,,,,,,,,,,,,,,,,,,,,,,,,,,,,,,,,,,,,,,,,,,,,,,,,,,,,,,,,,,,,,,,,,,,,,,,
,,,,,,,,,M099499,2020-07-27_17h23.29.917,Feng_Mindwandering_Set2,2020.1.3,Win32,60,space,4.168865,,0,7,7,7,1,1,7,"Mrs. Browning never intended for these poems to be published, but Robert promptly insisted that they must be.",0,Easy,2,2,,,,,,,,,,,,,,,,,,,,,,,,,,,,,,,,,,,,,,,,,,,,,,,,,,,,,,,,,,,,,,,,,,,,,,,,,,,,,,,,,,,,
,,,,,,,,,M099499,2020-07-27_17h23.29.917,Feng_Mindwandering_Set2,2020.1.3,Win32,60,space,2.029525,,0,8,8,8,1,1,8,He suggested calling them Sonnets from the Portuguese.,0,Easy,2,2,,,,,,,,,,,,,,,,,,,,,,,,,,,,,,,,,,,,,,,,,,,,,,,,,,,,,,,,,,,,,,,,,,,,,,,,,,,,,,,,,,,,
,,,,,,,,,M099499,2020-07-27_17h23.29.917,Feng_Mindwandering_Set2,2020.1.3,Win32,60,space,5.127375,,0,9,9,9,1,1,9,He may have suggested this title to hide the fact that the poems were personal.,0,Easy,2,2,,,,,,,,,,,,,,,,,,,,,,,,,,,,,,,,,,,,,,,,,,,,,,,,,,,,,,,,,,,,,,,,,,,,,,,,,,,,,,,,,,,,
,,,,,,,,,M099499,2020-07-27_17h23.29.917,Feng_Mindwandering_Set2,2020.1.3,Win32,60,space,10.679545,,0,10,10,10,1,1,10,He thought that these poems were “the finest sonnets written in our language since Shakespeare’s.”,0,Easy,2,2,,,,,,,,,,,,,,,,,,,,,,,,,,,,,,,,,,,,,,,,,,,,,,,,,,,,,,,,,,,,,,,,,,,,,,,,,,,,,,,,,,,,
,,,,,,,,,M099499,2020-07-27_17h23.29.917,Feng_Mindwandering_Set2,2020.1.3,Win32,60,space,13.709025,,0,11,11,11,1,1,11,"Robert Browning’s opinion of Sonnets from the Portuguese was flattering to his wife, the same as his opinion of most of her poetry.",0,Easy,2,2,,,,,,,,,,,,,,,,,,,,,,,,,,,,,,,,,,,,,,,,,,,,,,,,,,,,,,,,,,,,,,,,,,,,,,,,,,,,,,,,,,,,
,,,,,,,,,M099499,2020-07-27_17h23.29.917,Feng_Mindwandering_Set2,2020.1.3,Win32,60,space,5.47602,,0,12,12,12,1,1,12,"He thought that she was a better poet than he was, and the world at that time agreed with him.",0,Easy,2,2,,,,,,,,,,,,,,,,,,,,,,,,,,,,,,,,,,,,,,,,,,,,,,,,,,,,,,,,,,,,,,,,,,,,,,,,,,,,,,,,,,,,
,,,,,,,,,M099499,2020-07-27_17h23.29.917,Feng_Mindwandering_Set2,2020.1.3,Win32,60,space,8.82577,,0,13,13,13,1,1,13,"He called her his “moon of poets,” and she considered him her sun.",0,Easy,2,2,,,,,,,,,,,,,,,,,,,,,,,,,,,,,,,,,,,,,,,,,,,,,,,,,,,,,,,,,,,,,,,,,,,,,,,,,,,,,,,,,,,,
,,,,,,,,,M099499,2020-07-27_17h23.29.917,Feng_Mindwandering_Set2,2020.1.3,Win32,60,space,6.69661,,0,14,14,14,1,1,14,Elizabeth Barrett Browning was a pure singer with a lovely lyrical tenderness.,0,Easy,2,2,,,,,,,,,,,,,,,,,,,,,,,,,,,,,,,,,,,,,,,,,,,,,,,,,,,,,,,,,,,,,,,,,,,,,,,,,,,,,,,,,,,,
,,,,,,,,,M099499,2020-07-27_17h23.29.917,Feng_Mindwandering_Set2,2020.1.3,Win32,60,space,6.62688,,0,15,15,15,1,1,15,She was the best poet of her sex since Sappho.,0,Easy,2,2,,,,,,,,,,,,,,,,,,,,,,,,,,,,,,,,,,,,,,,,,,,,,,,,,,,,,,,,,,,,,,,,,,,,,,,,,,,,,,,,,,,,
,,,,,,,,,M099499,2020-07-27_17h23.29.917,Feng_Mindwandering_Set2,2020.1.3,Win32,60,space,3.145175,,0,16,16,16,1,1,16,Her Sonnets reveal a woman’s secret soul like no other poetry in our literature up to that time.,0,Easy,2,2,,,,,,,,,,,,,,,,,,,,,,,,,,,,,,,,,,,,,,,,,,,,,,,,,,,,,,,,,,,,,,,,,,,,,,,,,,,,,,,,,,,,
,,,,,,,,,M099499,2020-07-27_17h23.29.917,Feng_Mindwandering_Set2,2020.1.3,Win32,60,space,2.576785,,0,17,17,17,1,1,17,"They did so with autobiographical honesty, fine moderation and fullness.",0,Easy,2,2,,,,,,,,,,,,,,,,,,,,,,,,,,,,,,,,,,,,,,,,,,,,,,,,,,,,,,,,,,,,,,,,,,,,,,,,,,,,,,,,,,,,
,,,,,,,,,M099499,2020-07-27_17h23.29.917,Feng_Mindwandering_Set2,2020.1.3,Win32,60,space,37.8015,,0,18,18,18,1,1,18,Her lyrical mastery shines in many passages of her writings.,0,Easy,2,2,,,,,,,,,,,,,,,,,,,,,,,,,,,,,,,,,,,,,,,,,,,,,,,,,,,,,,,,,,,,,,,,,,,,,,,,,,,,,,,,,,,,
,,,,,,,,,M099499,2020-07-27_17h23.29.917,Feng_Mindwandering_Set2,2020.1.3,Win32,60,space,3.973485,,0,19,19,19,1,1,19,Italy was a kind of promised land for Elizabeth Browning.,0,Easy,2,2,,,,,,,,,,,,,,,,,,,,,,,,,,,,,,,,,,,,,,,,,,,,,,,,,,,,,,,,,,,,,,,,,,,,,,,,,,,,,,,,,,,,
,,,,,,,,,M099499,2020-07-27_17h23.29.917,Feng_Mindwandering_Set2,2020.1.3,Win32,60,space,2.845745,,0,20,20,20,1,1,20,"In the summer, she and her husband lived in Florence or in little villages.",0,Easy,2,2,,,,,,,,,,,,,,,,,,,,,,,,,,,,,,,,,,,,,,,,,,,,,,,,,,,,,,,,,,,,,,,,,,,,,,,,,,,,,,,,,,,,
,,,,,,,,,M099499,2020-07-27_17h23.29.917,Feng_Mindwandering_Set2,2020.1.3,Win32,60,space,3.128535,,0,21,21,21,1,1,21,She drank in the sun of the south and the warmth of her husband’s love.,0,Easy,2,2,,,,,,,,,,,,,,,,,,,,,,,,,,,,,,,,,,,,,,,,,,,,,,,,,,,,,,,,,,,,,,,,,,,,,,,,,,,,,,,,,,,,
,,,,,,,,,M099499,2020-07-27_17h23.29.917,Feng_Mindwandering_Set2,2020.1.3,Win32,60,space,7.350805,,0,22,22,22,1,1,22,She blossomed in a life of delicate happiness for fifteen years.,0,Easy,2,2,,,,,,,,,,,,,,,,,,,,,,,,,,,,,,,,,,,,,,,,,,,,,,,,,,,,,,,,,,,,,,,,,,,,,,,,,,,,,,,,,,,,
,,,,,,,,,M099499,2020-07-27_17h23.29.917,Feng_Mindwandering_Set2,2020.1.3,Win32,60,space,4.57243,,0,23,23,23,1,1,23,"She found friends in Italy, most of them cultured Americans.",0,Easy,2,2,,,,,,,,,,,,,,,,,,,,,,,,,,,,,,,,,,,,,,,,,,,,,,,,,,,,,,,,,,,,,,,,,,,,,,,,,,,,,,,,,,,,
,,,,,,,,,M099499,2020-07-27_17h23.29.917,Feng_Mindwandering_Set2,2020.1.3,Win32,60,space,17.459925,y,0,24,24,24,1,1,24,Hawthorne saw the Browning's there: the New England thinker and essayist Margaret Fuller visited them.,1,Easy,2,2,4.282135,,,,,,,,,,,,,,,,,,,,,,,,,,,,,,,,,,,,,,,,,,,,,,,,,,,,,,,,,,,,,,,,,,,,,,,,,,,,,,,,,,,
,,,,,,,,,M099499,2020-07-27_17h23.29.917,Feng_Mindwandering_Set2,2020.1.3,Win32,60,space,5.696945,,0,25,25,25,1,1,25,The painter Story and the young sculptress Harriet Hosmer came.,0,Easy,2,2,,,,,,,,,,,,,,,,,,,,,,,,,,,,,,,,,,,,,,,,,,,,,,,,,,,,,,,,,,,,,,,,,,,,,,,,,,,,,,,,,,,,
,,,,,,,,,M099499,2020-07-27_17h23.29.917,Feng_Mindwandering_Set2,2020.1.3,Win32,60,space,7.54248,y,0,26,26,26,1,1,26,"One caller records that Robert Browning was “simple, natural, and playful,” and that Mrs. Browning was all “genius and sensibility.”",1,Easy,2,2,1.73241,,,,,,,,,,,,,,,,,,,,,,,,,,,,,,,,,,,,,,,,,,,,,,,,,,,,,,,,,,,,,,,,,,,,,,,,,,,,,,,,,,,
,,,,,,,,,M099499,2020-07-27_17h23.29.917,Feng_Mindwandering_Set2,2020.1.3,Win32,60,space,11.03359,y,0,27,27,27,1,1,27,"Daytimes Browning walked forth with Elizabeth's little dog Flush, but he seldom could be lured from his home evenings.",1,Easy,2,2,3.50376,,,,,,,,,,,,,,,,,,,,,,,,,,,,,,,,,,,,,,,,,,,,,,,,,,,,,,,,,,,,,,,,,,,,,,,,,,,,,,,,,,,
,,,,,,,,,M099499,2020-07-27_17h23.29.917,Feng_Mindwandering_Set2,2020.1.3,Win32,60,space,8.71351,n,0,28,28,28,1,1,28,"One privileged intruder, coming frequently at night to join the poets over hot chestnuts and mulled wine, found talk good and laughter plentiful.",1,Easy,2,2,0.9639,,,,,,,,,,,,,,,,,,,,,,,,,,,,,,,,,,,,,,,,,,,,,,,,,,,,,,,,,,,,,,,,,,,,,,,,,,,,,,,,,,,
,,,,,,,,,M099499,2020-07-27_17h23.29.917,Feng_Mindwandering_Set2,2020.1.3,Win32,60,space,5.483045,,0,29,29,29,1,1,29,He found the talk good and the laughter plentiful.,0,Easy,2,2,,,,,,,,,,,,,,,,,,,,,,,,,,,,,,,,,,,,,,,,,,,,,,,,,,,,,,,,,,,,,,,,,,,,,,,,,,,,,,,,,,,,
,,,,,,,,,M099499,2020-07-27_17h23.29.917,Feng_Mindwandering_Set2,2020.1.3,Win32,60,space,2.614615,,0,30,30,30,1,1,30,"The Brownings had a son, Robert Weidemann Browning, during the third year of their stay in Italy.",0,Easy,2,2,,,,,,,,,,,,,,,,,,,,,,,,,,,,,,,,,,,,,,,,,,,,,,,,,,,,,,,,,,,,,,,,,,,,,,,,,,,,,,,,,,,,
,,,,,,,,,M099499,2020-07-27_17h23.29.917,Feng_Mindwandering_Set2,2020.1.3,Win32,60,space,1.489995,,0,31,31,31,1,1,31,But a strain of dark dread began to creep through this happy life.,0,Easy,2,2,,,,,,,,,,,,,,,,,,,,,,,,,,,,,,,,,,,,,,,,,,,,,,,,,,,,,,,,,,,,,,,,,,,,,,,,,,,,,,,,,,,,
,,,,,,,,,M099499,2020-07-27_17h23.29.917,Feng_Mindwandering_Set2,2020.1.3,Win32,60,space,18.8901,,0,32,32,32,1,1,32,Elizabeth Browning’s father died still disapproving of her marriage.,0,Easy,2,2,,,,,,,,,,,,,,,,,,,,,,,,,,,,,,,,,,,,,,,,,,,,,,,,,,,,,,,,,,,,,,,,,,,,,,,,,,,,,,,,,,,,
,,,,,,,,,M099499,2020-07-27_17h23.29.917,Feng_Mindwandering_Set2,2020.1.3,Win32,60,space,4.183675,,0,33,33,33,1,1,33,He had refused to see her or to allow any of his family to see her.,0,Easy,2,2,,,,,,,,,,,,,,,,,,,,,,,,,,,,,,,,,,,,,,,,,,,,,,,,,,,,,,,,,,,,,,,,,,,,,,,,,,,,,,,,,,,,
,,,,,,,,,M099499,2020-07-27_17h23.29.917,Feng_Mindwandering_Set2,2020.1.3,Win32,60,space,30.131935,,0,34,34,34,1,1,34,Elizabeth’s dearly loved sister died and left three children who were all younger than her own boy.,0,Easy,2,2,,,,,,,,,,,,,,,,,,,,,,,,,,,,,,,,,,,,,,,,,,,,,,,,,,,,,,,,,,,,,,,,,,,,,,,,,,,,,,,,,,,,
,,,,,,,,,M099499,2020-07-27_17h23.29.917,Feng_Mindwandering_Set2,2020.1.3,Win32,60,space,36.14165,,0,35,35,35,1,1,35,Elizabeth drooped and grieved a little and Robert shielded her from ordinary visitors.,0,Easy,2,2,,,,,,,,,,,,,,,,,,,,,,,,,,,,,,,,,,,,,,,,,,,,,,,,,,,,,,,,,,,,,,,,,,,,,,,,,,,,,,,,,,,,
,,,,,,,,,M099499,2020-07-27_17h23.29.917,Feng_Mindwandering_Set2,2020.1.3,Win32,60,space,8.92881,,0,36,36,36,1,1,36,She had a sudden and alarming attack of sickness but was not considered in any danger.,0,Easy,2,2,,,,,,,,,,,,,,,,,,,,,,,,,,,,,,,,,,,,,,,,,,,,,,,,,,,,,,,,,,,,,,,,,,,,,,,,,,,,,,,,,,,,
,,,,,,,,,M099499,2020-07-27_17h23.29.917,Feng_Mindwandering_Set2,2020.1.3,Win32,60,space,24.39205,,0,37,37,37,1,1,37,"One night, soon after, she awoke from a troubled sleep, apparently with no idea that she was about to leave Robert.",0,Easy,2,2,,,,,,,,,,,,,,,,,,,,,,,,,,,,,,,,,,,,,,,,,,,,,,,,,,,,,,,,,,,,,,,,,,,,,,,,,,,,,,,,,,,,
,,,,,,,,,M099499,2020-07-27_17h23.29.917,Feng_Mindwandering_Set2,2020.1.3,Win32,60,space,75.25212,,0,38,38,38,1,1,38,"She spoke tenderly about her love for him. In his arms, her head drooped as though in a faint, but it was the end.",0,Easy,2,2,,,,,,,,,,,,,,,,,,,,,,,,,,,,,,,,,,,,,,,,,,,,,,,,,,,,,,,,,,,,,,,,,,,,,,,,,,,,,,,,,,,,
,,,,,,,,,M099499,2020-07-27_17h23.29.917,Feng_Mindwandering_Set2,2020.1.3,Win32,60,space,9.465875,y,0,39,39,39,1,1,39,"Profound and lasting was Browning's grief. “Looking back,” he said, “I see that we have been all the time walking over a torrent on a straw.”",1,Easy,2,2,1.63708,,,,,,,,,,,,,,,,,,,,,,,,,,,,,,,,,,,,,,,,,,,,,,,,,,,,,,,,,,,,,,,,,,,,,,,,,,,,,,,,,,,
,,,,,,,,,M099499,2020-07-27_17h23.29.917,Feng_Mindwandering_Set2,2020.1.3,Win32,60,,,,,,,,,1,1,"1.     Flush was the name of the Brownings’

a.     Cat
b.     Dog
c.     Canary
d.     Turtle
e.     Thrush",,,,,,space,48.260715,b,1,6.68647,0,0,0,0,1,b,,,,,,,,,,,,,,,,,,,,,,,,,,,,,,,,,,,,,,,,,,,,,,,,,,,,,,,,,,,,,,,,,,,,,,,,
,,,,,,,,,M099499,2020-07-27_17h23.29.917,Feng_Mindwandering_Set2,2020.1.3,Win32,60,,,,,,,,,1,2,"2.     At night the Brownings often enjoyed

a.     hot chestnuts
b.     a tart with clotted cream
c.      strawberries and cream
d.     café au lait
e.     cheese soufflé",,,,,,,,c,0,5.40744,0,1,1,1,1,a,,,,,,,,,,,,,,,,,,,,,,,,,,,,,,,,,,,,,,,,,,,,,,,,,,,,,,,,,,,,,,,,,,,,,,,,
,,,,,,,,,M099499,2020-07-27_17h23.29.917,Feng_Mindwandering_Set2,2020.1.3,Win32,60,,,,,,,,,1,3,"3.     The Brownings saw

a.     Coleridge
b.     Byron
c.     Walt Whitman
d.     Poe
e.     Hawthorne",,,,,,,,d,0,4.478335,0,2,2,2,1,e,,,,,,,,,,,,,,,,,,,,,,,,,,,,,,,,,,,,,,,,,,,,,,,,,,,,,,,,,,,,,,,,,,,,,,,,
,,,,,,,,,M099499,2020-07-27_17h23.29.917,Feng_Mindwandering_Set2,2020.1.3,Win32,60,,,,,,,,,1,4,"4.     Browning wrote to Miss Barrett because she had

a.     invited him to visit
b.     written him for advice
c.     praised his poetry
d.     sent him one of her own poems
e.     sent a friend to meet him",,,,,,,,c,1,42.771885,0,3,3,3,1,c,,,,,,,,,,,,,,,,,,,,,,,,,,,,,,,,,,,,,,,,,,,,,,,,,,,,,,,,,,,,,,,,,,,,,,,,
,,,,,,,,,M099499,2020-07-27_17h23.29.917,Feng_Mindwandering_Set2,2020.1.3,Win32,60,,,,,,,,,1,5,"5.     The authors of this passage placed most attention on the Brownings’

a.     literary efforts
b.     personal relationship
c.     social contacts
d.     problems
e.     early meeting",,,,,,,,a,0,19.943855,0,4,4,4,1,b,,,,,,,,,,,,,,,,,,,,,,,,,,,,,,,,,,,,,,,,,,,,,,,,,,,,,,,,,,,,,,,,,,,,,,,,
,,,,,,,,,M099499,2020-07-27_17h23.29.917,Feng_Mindwandering_Set2,2020.1.3,Win32,60,,,,,,,,,1,6,"6.     What best describes the Brownings’ early days abroad?

a.     Travel
b.     Relaxation
c.     Creative activity
d.     Intellectual stimulation
e.     Happiness",,,,,,,,c,0,20.21046,0,5,5,5,1,e,,,,,,,,,,,,,,,,,,,,,,,,,,,,,,,,,,,,,,,,,,,,,,,,,,,,,,,,,,,,,,,,,,,,,,,,
,,,,,,,,,M099499,2020-07-27_17h23.29.917,Feng_Mindwandering_Set2,2020.1.3,Win32,60,,,,,,,,,1,7,"7.     You would assume that Browning

a.     found it easy to see Elizabeth
b.     carefully avoided Mr. Barrett
c.     begged Mr. Barrett’s consent to marry
d.     understood Mr. Barrett
e.     got Elizabeth to ask her father’s consent",,,,,,,,d,0,34.8117,0,6,6,6,1,b,,,,,,,,,,,,,,,,,,,,,,,,,,,,,,,,,,,,,,,,,,,,,,,,,,,,,,,,,,,,,,,,,,,,,,,,
,,,,,,,,,M099499,2020-07-27_17h23.29.917,Feng_Mindwandering_Set2,2020.1.3,Win32,60,,,,,,,,,1,8,"8.     In the “torrent on a straw” quotation, the word straw probably refers to

a.     the frailty of life
b.     weakness of character
c.     sorrow
d.     happiness
e.     the fleeting nature of fame",,,,,,,,d,0,7.995145,0,7,7,7,1,a,,,,,,,,,,,,,,,,,,,,,,,,,,,,,,,,,,,,,,,,,,,,,,,,,,,,,,,,,,,,,,,,,,,,,,,,
,,,,,,,,,M099499,2020-07-27_17h23.29.917,Feng_Mindwandering_Set2,2020.1.3,Win32,60,space,34.63943,,,,,,,2,0,Passage 2,0,Diff,1,2,,,,,,,,,,,,,0,0,0,0,1,,,,,,,,,,,,,,,,,,,,,,,,,,,,,,,,,,,,,,,,,,,,,,,,,,,,,,,,,,,,,,,,,,,
,,,,,,,,,M099499,2020-07-27_17h23.29.917,Feng_Mindwandering_Set2,2020.1.3,Win32,60,space,4.015345,,,,,,,2,1,The performance of those business activities that direct the flow of goods and services from producer to consumer or user is called marketing. ,0,Diff,1,2,,,,,,,,,,,,,0,1,1,1,1,,,,,,,,,,,,,,,,,,,,,,,,,,,,,,,,,,,,,,,,,,,,,,,,,,,,,,,,,,,,,,,,,,,
,,,,,,,,,M099499,2020-07-27_17h23.29.917,Feng_Mindwandering_Set2,2020.1.3,Win32,60,space,80.19089,,,,,,,2,2,Marketing is the connecting link between the producer and the consumer or user.,0,Diff,1,2,,,,,,,,,,,,,0,2,2,2,1,,,,,,,,,,,,,,,,,,,,,,,,,,,,,,,,,,,,,,,,,,,,,,,,,,,,,,,,,,,,,,,,,,,
,,,,,,,,,M099499,2020-07-27_17h23.29.917,Feng_Mindwandering_Set2,2020.1.3,Win32,60,space,3.82758,,,,,,,2,3,Production and consumption are brought together by the marketing system.,0,Diff,1,2,,,,,,,,,,,,,0,3,3,3,1,,,,,,,,,,,,,,,,,,,,,,,,,,,,,,,,,,,,,,,,,,,,,,,,,,,,,,,,,,,,,,,,,,,
,,,,,,,,,M099499,2020-07-27_17h23.29.917,Feng_Mindwandering_Set2,2020.1.3,Win32,60,space,6.078455,,,,,,,2,4,Wholesaling or retailing activities are directly engaged in by approximately one in every six gainfully employed persons.,0,Diff,1,2,,,,,,,,,,,,,0,4,4,4,1,,,,,,,,,,,,,,,,,,,,,,,,,,,,,,,,,,,,,,,,,,,,,,,,,,,,,,,,,,,,,,,,,,,
,,,,,,,,,M099499,2020-07-27_17h23.29.917,Feng_Mindwandering_Set2,2020.1.3,Win32,60,space,1.69531,,,,,,,2,5,"This ratio does not take into account other persons who are serving marketing through transportation, communication, and office vocations.",0,Diff,1,2,,,,,,,,,,,,,0,5,5,5,1,,,,,,,,,,,,,,,,,,,,,,,,,,,,,,,,,,,,,,,,,,,,,,,,,,,,,,,,,,,,,,,,,,,
,,,,,,,,,M099499,2020-07-27_17h23.29.917,Feng_Mindwandering_Set2,2020.1.3,Win32,60,space,2.999155,,,,,,,2,6,Opportunities for many kinds of positions requiring a wide range of skills and abilities is provided by marketing.,0,Diff,1,2,,,,,,,,,,,,,0,6,6,6,1,,,,,,,,,,,,,,,,,,,,,,,,,,,,,,,,,,,,,,,,,,,,,,,,,,,,,,,,,,,,,,,,,,,
,,,,,,,,,M099499,2020-07-27_17h23.29.917,Feng_Mindwandering_Set2,2020.1.3,Win32,60,space,6.10062,,,,,,,2,7,"Although one naturally thinks of merchandising as being the primary occupation in marketing, there are opportunities in management, advertising, market and product research, and purchasing.",0,Diff,1,2,,,,,,,,,,,,,0,7,7,7,1,,,,,,,,,,,,,,,,,,,,,,,,,,,,,,,,,,,,,,,,,,,,,,,,,,,,,,,,,,,,,,,,,,,
,,,,,,,,,M099499,2020-07-27_17h23.29.917,Feng_Mindwandering_Set2,2020.1.3,Win32,60,space,4.96038,y,,,,,,2,8,"The economic well-being of one’s country is determined largely by productivity, consumption, and employment. ",1,Diff,1,2,1.68571,,,,,,,,,,,,0,8,8,8,1,,,,,,,,,,,,,,,,,,,,,,,,,,,,,,,,,,,,,,,,,,,,,,,,,,,,,,,,,,,,,,,,,,,
,,,,,,,,,M099499,2020-07-27_17h23.29.917,Feng_Mindwandering_Set2,2020.1.3,Win32,60,space,3.83134,,,,,,,2,9,All three are affected by the efficiency of the marketing process.,0,Diff,1,2,,,,,,,,,,,,,0,9,9,9,1,,,,,,,,,,,,,,,,,,,,,,,,,,,,,,,,,,,,,,,,,,,,,,,,,,,,,,,,,,,,,,,,,,,
,,,,,,,,,M099499,2020-07-27_17h23.29.917,Feng_Mindwandering_Set2,2020.1.3,Win32,60,space,11.56804,,,,,,,2,10,"If marketing stimulates appetite, people will consume goods at a high rate.",0,Diff,1,2,,,,,,,,,,,,,0,10,10,10,1,,,,,,,,,,,,,,,,,,,,,,,,,,,,,,,,,,,,,,,,,,,,,,,,,,,,,,,,,,,,,,,,,,,
,,,,,,,,,M099499,2020-07-27_17h23.29.917,Feng_Mindwandering_Set2,2020.1.3,Win32,60,space,6.892605,y,,,,,,2,11,"High consumption requires high productivity to meet the requirements of people, and high productivity and high-level activity in marketing combined result in high employment.",1,Diff,1,2,1.235415,,,,,,,,,,,,0,11,11,11,1,,,,,,,,,,,,,,,,,,,,,,,,,,,,,,,,,,,,,,,,,,,,,,,,,,,,,,,,,,,,,,,,,,,
,,,,,,,,,M099499,2020-07-27_17h23.29.917,Feng_Mindwandering_Set2,2020.1.3,Win32,60,space,3.91035,,,,,,,2,12,"Indirectly, marketing is a key to a high level of economic living for the people.",0,Diff,1,2,,,,,,,,,,,,,0,12,12,12,1,,,,,,,,,,,,,,,,,,,,,,,,,,,,,,,,,,,,,,,,,,,,,,,,,,,,,,,,,,,,,,,,,,,
,,,,,,,,,M099499,2020-07-27_17h23.29.917,Feng_Mindwandering_Set2,2020.1.3,Win32,60,,,,,,,,,2,1,"1.     Our economic well-being is determined largely by how many factors?

a.     One
b.     Two
c.     Three
d.     Four
e.     Five",,,,,,space,13.63652,c,1,4.38957,,,,,,c,,,,,,0,0,0,0,1,,,,,,,,,,,,,,,,,,,,,,,,,,,,,,,,,,,,,,,,,,,,,,,,,,,,,,,,,,,,,,
